"No.","Time","\316\224 Time","TCP Time","Source","Destination","Protocol","Length","Window","TCP Segment Len","Info"
"1","0.000000","0.000000","0.000000000","safebrowsing.googleapis.com","LAPTOP-KeiyuKensei.local","TLSv1.2","94","1050","40","Application Data"
"2","0.040752","0.040752","0.040752000","LAPTOP-KeiyuKensei.local","safebrowsing.googleapis.com","TCP","54","251","0","12066  >  https(443) [ACK] Seq=1 Ack=41 Win=251 Len=0"
"3","0.256546","0.215794","","LAPTOP-KeiyuKensei.local","myfastgate","DNS","98","","","Standard query 0x174a PTR 42.209.251.142.in-addr.arpa OPT"
"4","0.257031","0.000485","","LAPTOP-KeiyuKensei.local","myfastgate","DNS","96","","","Standard query 0xced8 PTR 52.1.168.192.in-addr.arpa OPT"
"5","0.263712","0.006681","","myfastgate","LAPTOP-KeiyuKensei.local","DNS","96","","","Standard query response 0xced8 No such name PTR 52.1.168.192.in-addr.arpa OPT"
"6","0.273356","0.009644","","myfastgate","LAPTOP-KeiyuKensei.local","DNS","137","","","Standard query response 0x174a PTR 42.209.251.142.in-addr.arpa PTR mil04s51-in-f10.1e100.net OPT"
"7","1.231380","0.958024","","LAPTOP-KeiyuKensei.local","myfastgate","DNS","97","","","Standard query 0x426b PTR 254.1.168.192.in-addr.arpa OPT"
"8","1.235118","0.003738","","myfastgate","LAPTOP-KeiyuKensei.local","DNS","121","","","Standard query response 0x426b PTR 254.1.168.192.in-addr.arpa PTR myfastgate OPT"
"9","3.497778","2.262660","0.000000000","LAPTOP-KeiyuKensei.local","signaler-pa.GoOgLeapIS.coM","TLSv1.2","929","255","875","Application Data"
"10","3.498143","0.000365","0.000365000","LAPTOP-KeiyuKensei.local","signaler-pa.GoOgLeapIS.coM","TLSv1.2","81","255","27","Application Data"
"11","3.516585","0.018442","0.018442000","signaler-pa.GoOgLeapIS.coM","LAPTOP-KeiyuKensei.local","TCP","56","443","0","https(443)  >  13425 [ACK] Seq=1 Ack=876 Win=443 Len=0"
"12","3.516585","0.000000","0.000000000","signaler-pa.GoOgLeapIS.coM","LAPTOP-KeiyuKensei.local","TCP","56","443","0","https(443)  >  13425 [ACK] Seq=1 Ack=903 Win=443 Len=0"
"13","3.674896","0.158311","0.158311000","signaler-pa.GoOgLeapIS.coM","LAPTOP-KeiyuKensei.local","TLSv1.2","918","443","864","Application Data"
"14","3.675543","0.000647","0.000647000","signaler-pa.GoOgLeapIS.coM","LAPTOP-KeiyuKensei.local","TLSv1.2","81","443","27","Application Data"
"15","3.675593","0.000050","0.000050000","LAPTOP-KeiyuKensei.local","signaler-pa.GoOgLeapIS.coM","TCP","54","252","0","13425  >  https(443) [ACK] Seq=903 Ack=892 Win=252 Len=0"
"16","4.230775","0.555182","","LAPTOP-KeiyuKensei.local","myfastgate","DNS","99","","","Standard query 0x7ec9 PTR 170.180.250.142.in-addr.arpa OPT"
"17","4.246665","0.015890","","myfastgate","LAPTOP-KeiyuKensei.local","DNS","138","","","Standard query response 0x7ec9 PTR 170.180.250.142.in-addr.arpa PTR mil04s44-in-f10.1e100.net OPT"
"18","4.498477","0.251812","","LAPTOP-KeiyuKensei.local","myfastgate","DNS","80","","","Standard query 0x4e04 A autoupdate.opera.com"
"19","4.499215","0.000738","","LAPTOP-KeiyuKensei.local","myfastgate","DNS","80","","","Standard query 0xdc77 HTTPS autoupdate.opera.com"
"20","4.510573","0.011358","","myfastgate","LAPTOP-KeiyuKensei.local","DNS","187","","","Standard query response 0x4e04 A autoupdate.opera.com CNAME autoupdate.geo.opera.com CNAME eu-autoupdate.opera.com A 185.26.182.124 A 185.26.182.123"
"21","4.514441","0.003868","","LAPTOP-KeiyuKensei.local","myfastgate","DNS","80","","","Standard query 0xcd5a A proxy.gxcorner.games"
"22","4.515460","0.001019","","LAPTOP-KeiyuKensei.local","myfastgate","DNS","80","","","Standard query 0xcbb2 HTTPS proxy.gxcorner.games"
"23","4.516742","0.001282","","LAPTOP-KeiyuKensei.local","myfastgate","DNS","86","","","Standard query 0x57f0 A merchandise.opera-api2.com"
"24","4.517285","0.000543","","LAPTOP-KeiyuKensei.local","myfastgate","DNS","86","","","Standard query 0x2a17 HTTPS merchandise.opera-api2.com"
"25","4.518042","0.000757","","myfastgate","LAPTOP-KeiyuKensei.local","DNS","199","","","Standard query response 0xdc77 HTTPS autoupdate.opera.com CNAME autoupdate.geo.opera.com CNAME eu2-autoupdate.opera.com SOA nic1.opera.com"
"26","4.518830","0.000788","0.000000000","LAPTOP-KeiyuKensei.local","eu-autoupdate.opera.com","TCP","66","65535","0","13994  >  https(443) [SYN] Seq=0 Win=65535 Len=0 MSS=1460 WS=256 SACK_PERM"
"27","4.521032","0.002202","","myfastgate","LAPTOP-KeiyuKensei.local","DNS","112","","","Standard query response 0xcd5a A proxy.gxcorner.games A 104.18.6.134 A 104.18.7.134"
"28","4.525574","0.004542","","myfastgate","LAPTOP-KeiyuKensei.local","DNS","118","","","Standard query response 0x57f0 A merchandise.opera-api2.com A 185.26.182.111 A 185.26.182.112"
"29","4.532869","0.007295","0.000000000","LAPTOP-KeiyuKensei.local","proxy.gxcorner.games","TCP","66","65535","0","13995  >  https(443) [SYN] Seq=0 Win=65535 Len=0 MSS=1460 WS=256 SACK_PERM"
"30","4.533657","0.000788","0.000000000","LAPTOP-KeiyuKensei.local","ams-af.oPEra.coM","TCP","66","65535","0","13996  >  https(443) [SYN] Seq=0 Win=65535 Len=0 MSS=1460 WS=256 SACK_PERM"
"31","4.535757","0.002100","","myfastgate","LAPTOP-KeiyuKensei.local","DNS","150","","","Standard query response 0xcbb2 HTTPS proxy.gxcorner.games HTTPS"
"32","4.536799","0.001042","","myfastgate","LAPTOP-KeiyuKensei.local","DNS","147","","","Standard query response 0x2a17 HTTPS merchandise.opera-api2.com SOA nic1.opera.com"
"33","4.554034","0.017235","0.021165000","proxy.gxcorner.games","LAPTOP-KeiyuKensei.local","TCP","66","65535","0","https(443)  >  13995 [SYN, ACK] Seq=0 Ack=1 Win=65535 Len=0 MSS=1400 SACK_PERM WS=8192"
"34","4.554254","0.000220","0.000220000","LAPTOP-KeiyuKensei.local","proxy.gxcorner.games","TCP","54","255","0","13995  >  https(443) [ACK] Seq=1 Ack=1 Win=65280 Len=0"
"35","4.556109","0.001855","0.001855000","LAPTOP-KeiyuKensei.local","proxy.gxcorner.games","TCP","1454","255","1400","13995  >  https(443) [ACK] Seq=1 Ack=1 Win=65280 Len=1400 [TCP PDU reassembled in 36]"
"36","4.556109","0.000000","0.000000000","LAPTOP-KeiyuKensei.local","proxy.gxcorner.games","TLSv1.3","480","255","426","Client Hello (SNI=proxy.gxcorner.games)"
"37","4.560897","0.004788","0.042067000","eu-autoupdate.opera.com","LAPTOP-KeiyuKensei.local","TCP","66","42340","0","https(443)  >  13994 [SYN, ACK] Seq=0 Ack=1 Win=42340 Len=0 MSS=1412 SACK_PERM WS=512"
"38","4.561049","0.000152","0.000152000","LAPTOP-KeiyuKensei.local","eu-autoupdate.opera.com","TCP","54","255","0","13994  >  https(443) [ACK] Seq=1 Ack=1 Win=65280 Len=0"
"39","4.562401","0.001352","0.001352000","LAPTOP-KeiyuKensei.local","eu-autoupdate.opera.com","TCP","1466","255","1412","13994  >  https(443) [ACK] Seq=1 Ack=1 Win=65280 Len=1412 [TCP PDU reassembled in 40]"
"40","4.562401","0.000000","0.000000000","LAPTOP-KeiyuKensei.local","eu-autoupdate.opera.com","TLSv1.3","372","255","318","Client Hello (SNI=autoupdate.opera.com)"
"41","4.574237","0.011836","0.040580000","ams-af.oPEra.coM","LAPTOP-KeiyuKensei.local","TCP","66","42340","0","https(443)  >  13996 [SYN, ACK] Seq=0 Ack=1 Win=42340 Len=0 MSS=1412 SACK_PERM WS=512"
"42","4.574370","0.000133","0.000133000","LAPTOP-KeiyuKensei.local","ams-af.oPEra.coM","TCP","54","255","0","13996  >  https(443) [ACK] Seq=1 Ack=1 Win=65280 Len=0"
"43","4.575265","0.000895","0.000895000","LAPTOP-KeiyuKensei.local","ams-af.oPEra.coM","TCP","1466","255","1412","13996  >  https(443) [ACK] Seq=1 Ack=1 Win=65280 Len=1412 [TCP PDU reassembled in 44]"
"44","4.575265","0.000000","0.000000000","LAPTOP-KeiyuKensei.local","ams-af.oPEra.coM","TLSv1.3","442","255","388","Client Hello (SNI=merchandise.opera-api2.com)"
"45","4.578173","0.002908","0.022064000","proxy.gxcorner.games","LAPTOP-KeiyuKensei.local","TCP","54","8","0","https(443)  >  13995 [ACK] Seq=1 Ack=1827 Win=65536 Len=0"
"46","4.586464","0.008291","0.008291000","proxy.gxcorner.games","LAPTOP-KeiyuKensei.local","TLSv1.3","1466","8","1412","Server Hello, Change Cipher Spec"
"47","4.586464","0.000000","0.000000000","proxy.gxcorner.games","LAPTOP-KeiyuKensei.local","TCP","1466","8","1412","https(443)  >  13995 [ACK] Seq=1413 Ack=1827 Win=65536 Len=1412 [TCP PDU reassembled in 49]"
"48","4.586608","0.000144","0.000144000","LAPTOP-KeiyuKensei.local","proxy.gxcorner.games","TCP","54","255","0","13995  >  https(443) [ACK] Seq=1827 Ack=2825 Win=65280 Len=0"
"49","4.586732","0.000124","0.000124000","proxy.gxcorner.games","LAPTOP-KeiyuKensei.local","TLSv1.3","704","8","650","Application Data"
"50","4.595485","0.008753","","LAPTOP-KeiyuKensei.local","myfastgate","DNS","88","","","Standard query 0x86a3 A co-merchandise.opera-api.com"
"51","4.596297","0.000812","","LAPTOP-KeiyuKensei.local","myfastgate","DNS","88","","","Standard query 0xd269 HTTPS co-merchandise.opera-api.com"
"52","4.605861","0.009564","0.043460000","eu-autoupdate.opera.com","LAPTOP-KeiyuKensei.local","TCP","54","82","0","https(443)  >  13994 [ACK] Seq=1 Ack=1731 Win=41984 Len=0"
"53","4.605861","0.000000","0.000000000","eu-autoupdate.opera.com","LAPTOP-KeiyuKensei.local","TLSv1.3","1466","83","1412","Server Hello, Change Cipher Spec, Application Data"
"54","4.606039","0.000178","0.000178000","eu-autoupdate.opera.com","LAPTOP-KeiyuKensei.local","TCP","1466","83","1412","https(443)  >  13994 [PSH, ACK] Seq=1413 Ack=1731 Win=42496 Len=1412 [TCP PDU reassembled in 55]"
"55","4.606039","0.000000","0.000000000","eu-autoupdate.opera.com","LAPTOP-KeiyuKensei.local","TLSv1.3","985","83","931","Application Data, Application Data, Application Data"
"56","4.606105","0.000066","0.000066000","LAPTOP-KeiyuKensei.local","eu-autoupdate.opera.com","TCP","54","255","0","13994  >  https(443) [ACK] Seq=1731 Ack=3756 Win=65280 Len=0"
"57","4.614532","0.008427","","myfastgate","LAPTOP-KeiyuKensei.local","DNS","339","","","Standard query response 0x86a3 A co-merchandise.opera-api.com CNAME co-merchandise.geo.opera.com CNAME co-merchandise-am4.opera-api.com CNAME am4.lb.opera.technology A 82.145.216.59 A 82.145.216.16 A 82.145.216.15 A 82.145.216.58"
"58","4.614532","0.000000","","myfastgate","LAPTOP-KeiyuKensei.local","DNS","277","","","Standard query response 0xd269 HTTPS co-merchandise.opera-api.com CNAME co-merchandise.geo.opera.com CNAME co-merchandise-ams.opera-api.com CNAME ams.lb.opera.technology SOA nic1.opera.com"
"59","4.616133","0.001601","0.000000000","LAPTOP-KeiyuKensei.local","am4.lb.opera.technology","TCP","66","65535","0","13997  >  https(443) [SYN] Seq=0 Win=65535 Len=0 MSS=1460 WS=256 SACK_PERM"
"60","4.618635","0.002502","0.043370000","ams-af.oPEra.coM","LAPTOP-KeiyuKensei.local","TCP","54","82","0","https(443)  >  13996 [ACK] Seq=1 Ack=1801 Win=41984 Len=0"
"61","4.619415","0.000780","0.000780000","ams-af.oPEra.coM","LAPTOP-KeiyuKensei.local","TLSv1.3","1466","83","1412","Server Hello, Change Cipher Spec, Application Data"
"62","4.619415","0.000000","0.000000000","ams-af.oPEra.coM","LAPTOP-KeiyuKensei.local","TLSv1.3","1466","83","1412","Application Data"
"63","4.619415","0.000000","0.000000000","ams-af.oPEra.coM","LAPTOP-KeiyuKensei.local","TLSv1.3","207","83","153","Application Data, Application Data"
"64","4.619587","0.000172","0.000172000","LAPTOP-KeiyuKensei.local","ams-af.oPEra.coM","TCP","54","255","0","13996  >  https(443) [ACK] Seq=1801 Ack=2978 Win=65280 Len=0"
"65","4.628383","0.008796","0.041651000","LAPTOP-KeiyuKensei.local","proxy.gxcorner.games","TCP","54","253","0","13995  >  https(443) [ACK] Seq=1827 Ack=3475 Win=64768 Len=0"
"66","4.642382","0.013999","0.026249000","am4.lb.opera.technology","LAPTOP-KeiyuKensei.local","TCP","66","42340","0","https(443)  >  13997 [SYN, ACK] Seq=0 Ack=1 Win=42340 Len=0 MSS=1412 SACK_PERM WS=512"
"67","4.642525","0.000143","0.000143000","LAPTOP-KeiyuKensei.local","am4.lb.opera.technology","TCP","54","255","0","13997  >  https(443) [ACK] Seq=1 Ack=1 Win=65280 Len=0"
"68","4.643452","0.000927","0.000927000","LAPTOP-KeiyuKensei.local","am4.lb.opera.technology","TCP","1466","255","1412","13997  >  https(443) [ACK] Seq=1 Ack=1 Win=65280 Len=1412 [TCP PDU reassembled in 69]"
"69","4.643452","0.000000","0.000000000","LAPTOP-KeiyuKensei.local","am4.lb.opera.technology","TLSv1.3","476","255","422","Client Hello (SNI=co-merchandise.opera-api.com)"
"70","4.669114","0.025662","0.025662000","am4.lb.opera.technology","LAPTOP-KeiyuKensei.local","TCP","54","83","0","https(443)  >  13997 [ACK] Seq=1 Ack=1413 Win=42496 Len=0"
"71","4.669114","0.000000","0.000000000","am4.lb.opera.technology","LAPTOP-KeiyuKensei.local","TCP","56","83","0","https(443)  >  13997 [ACK] Seq=1 Ack=1835 Win=42496 Len=0"
"72","4.669917","0.000803","0.000803000","am4.lb.opera.technology","LAPTOP-KeiyuKensei.local","TLSv1.3","1466","83","1412","Server Hello, Change Cipher Spec, Application Data"
"73","4.669917","0.000000","0.000000000","am4.lb.opera.technology","LAPTOP-KeiyuKensei.local","TLSv1.3","1466","83","1412","Application Data"
"74","4.669917","0.000000","0.000000000","am4.lb.opera.technology","LAPTOP-KeiyuKensei.local","TLSv1.3","216","83","162","Application Data, Application Data"
"75","4.670068","0.000151","0.000151000","LAPTOP-KeiyuKensei.local","am4.lb.opera.technology","TCP","54","255","0","13997  >  https(443) [ACK] Seq=1835 Ack=2987 Win=65280 Len=0"
"76","4.676763","0.006695","0.000000000","LAPTOP-KeiyuKensei.local","eu-autoupdate.opera.com","TCP","66","65535","0","13998  >  https(443) [SYN] Seq=0 Win=65535 Len=0 MSS=1460 WS=256 SACK_PERM"
"77","4.717161","0.040398","0.040398000","eu-autoupdate.opera.com","LAPTOP-KeiyuKensei.local","TCP","66","42340","0","https(443)  >  13998 [SYN, ACK] Seq=0 Ack=1 Win=42340 Len=0 MSS=1412 SACK_PERM WS=512"
"78","4.717338","0.000177","0.000177000","LAPTOP-KeiyuKensei.local","eu-autoupdate.opera.com","TCP","54","255","0","13998  >  https(443) [ACK] Seq=1 Ack=1 Win=65280 Len=0"
"79","4.718761","0.001423","0.001423000","LAPTOP-KeiyuKensei.local","eu-autoupdate.opera.com","TCP","1466","255","1412","13998  >  https(443) [ACK] Seq=1 Ack=1 Win=65280 Len=1412 [TCP PDU reassembled in 80]"
"80","4.718761","0.000000","0.000000000","LAPTOP-KeiyuKensei.local","eu-autoupdate.opera.com","TLSv1.3","436","255","382","Client Hello (SNI=autoupdate.opera.com)"
"81","4.759860","0.041099","0.041099000","eu-autoupdate.opera.com","LAPTOP-KeiyuKensei.local","TCP","54","82","0","https(443)  >  13998 [ACK] Seq=1 Ack=1795 Win=41984 Len=0"
"82","4.759860","0.000000","0.000000000","eu-autoupdate.opera.com","LAPTOP-KeiyuKensei.local","TLSv1.3","1466","83","1412","Server Hello, Change Cipher Spec, Application Data"
"83","4.759860","0.000000","0.000000000","eu-autoupdate.opera.com","LAPTOP-KeiyuKensei.local","TCP","1466","83","1412","https(443)  >  13998 [PSH, ACK] Seq=1413 Ack=1795 Win=42496 Len=1412 [TCP PDU reassembled in 84]"
"84","4.759860","0.000000","0.000000000","eu-autoupdate.opera.com","LAPTOP-KeiyuKensei.local","TLSv1.3","985","83","931","Application Data, Application Data, Application Data"
"85","4.760051","0.000191","0.000191000","LAPTOP-KeiyuKensei.local","eu-autoupdate.opera.com","TCP","54","255","0","13998  >  https(443) [ACK] Seq=1795 Ack=3756 Win=65280 Len=0"
"86","6.010050","1.249999","","LAPTOP-KeiyuKensei.local","myfastgate","DNS","79","","","Standard query 0x2024 A sitecheck.opera.com"
"87","6.010680","0.000630","","LAPTOP-KeiyuKensei.local","myfastgate","DNS","79","","","Standard query 0x3327 HTTPS sitecheck.opera.com"
"88","6.026759","0.016079","","myfastgate","LAPTOP-KeiyuKensei.local","DNS","176","","","Standard query response 0x2024 A sitecheck.opera.com CNAME sitecheck.geo.opera.com CNAME am4-sitecheck.opera.com A 82.145.216.16 A 82.145.216.15"
"89","6.033304","0.006545","","myfastgate","LAPTOP-KeiyuKensei.local","DNS","305","","","Standard query response 0x3327 HTTPS sitecheck.opera.com CNAME sitecheck.geo.opera.com CNAME ams-sitecheck.opera.com CNAME ams.lb.opera.technology SOA nic1.opera.com"
"90","6.033940","0.000636","0.000000000","LAPTOP-KeiyuKensei.local","am4-sitecheck.opera.com","TCP","66","65535","0","13999  >  https(443) [SYN] Seq=0 Win=65535 Len=0 MSS=1460 WS=256 SACK_PERM"
"91","6.065566","0.031626","0.031626000","am4-sitecheck.opera.com","LAPTOP-KeiyuKensei.local","TCP","58","42340","0","https(443)  >  13999 [SYN, ACK] Seq=0 Ack=1 Win=42340 Len=0 MSS=1412"
"92","6.065726","0.000160","0.000160000","LAPTOP-KeiyuKensei.local","am4-sitecheck.opera.com","TCP","54","65535","0","13999  >  https(443) [ACK] Seq=1 Ack=1 Win=65535 Len=0"
"93","6.066737","0.001011","0.001011000","LAPTOP-KeiyuKensei.local","am4-sitecheck.opera.com","TCP","1466","65535","1412","13999  >  https(443) [ACK] Seq=1 Ack=1 Win=65535 Len=1412 [TCP PDU reassembled in 94]"
"94","6.066737","0.000000","0.000000000","LAPTOP-KeiyuKensei.local","am4-sitecheck.opera.com","TLSv1.3","467","65535","413","Client Hello (SNI=sitecheck.opera.com)"
"95","6.101637","0.034900","0.034900000","am4-sitecheck.opera.com","LAPTOP-KeiyuKensei.local","TCP","54","41075","0","https(443)  >  13999 [ACK] Seq=1 Ack=1826 Win=41075 Len=0"
"96","6.103468","0.001831","0.001831000","am4-sitecheck.opera.com","LAPTOP-KeiyuKensei.local","TLSv1.3","1354","41075","1300","Server Hello, Change Cipher Spec, Application Data"
"97","6.103649","0.000181","0.000181000","am4-sitecheck.opera.com","LAPTOP-KeiyuKensei.local","TCP","1354","41075","1300","https(443)  >  13999 [ACK] Seq=1301 Ack=1826 Win=41075 Len=1300 [TCP PDU reassembled in 98]"
"98","6.103649","0.000000","0.000000000","am4-sitecheck.opera.com","LAPTOP-KeiyuKensei.local","TLSv1.3","575","41075","521","Application Data, Application Data, Application Data"
"99","6.103709","0.000060","0.000060000","LAPTOP-KeiyuKensei.local","am4-sitecheck.opera.com","TCP","54","65535","0","13999  >  https(443) [ACK] Seq=1826 Ack=3122 Win=65535 Len=0"
"100","6.546740","0.443031","0.000000000","LAPTOP-KeiyuKensei.local","signaler-pa.GoOgLeapIS.coM","TLSv1.2","779","253","725","Application Data"
"101","6.559879","0.013139","0.013139000","signaler-pa.GoOgLeapIS.coM","LAPTOP-KeiyuKensei.local","TCP","56","4868","0","https(443)  >  13135 [ACK] Seq=1 Ack=726 Win=4868 Len=0"
"102","6.681373","0.121494","0.121494000","signaler-pa.GoOgLeapIS.coM","LAPTOP-KeiyuKensei.local","TLSv1.2","434","4868","380","Application Data"
"103","6.685280","0.003907","0.003907000","LAPTOP-KeiyuKensei.local","signaler-pa.GoOgLeapIS.coM","TLSv1.2","934","251","880","Application Data"
"104","6.685373","0.000093","0.000000000","LAPTOP-KeiyuKensei.local","signaler-pa.GoOgLeapIS.coM","TLSv1.2","690","255","636","Application Data"
"105","6.696626","0.011253","0.011346000","signaler-pa.GoOgLeapIS.coM","LAPTOP-KeiyuKensei.local","TCP","56","4879","0","https(443)  >  13135 [ACK] Seq=381 Ack=1606 Win=4879 Len=0"
"106","6.697293","0.000667","0.011920000","signaler-pa.GoOgLeapIS.coM","LAPTOP-KeiyuKensei.local","TCP","56","477","0","https(443)  >  i-zipqd(13160) [ACK] Seq=1 Ack=637 Win=477 Len=0"
"107","6.806527","0.109234","0.109901000","signaler-pa.GoOgLeapIS.coM","LAPTOP-KeiyuKensei.local","TLSv1.2","356","4879","302","Application Data"
"108","6.818323","0.011796","0.121030000","signaler-pa.GoOgLeapIS.coM","LAPTOP-KeiyuKensei.local","TLSv1.2","1466","477","1412","Application Data"
"109","6.819412","0.001089","0.001089000","signaler-pa.GoOgLeapIS.coM","LAPTOP-KeiyuKensei.local","TLSv1.2","532","477","478","Application Data"
"110","6.819540","0.000128","0.000128000","LAPTOP-KeiyuKensei.local","signaler-pa.GoOgLeapIS.coM","TCP","54","255","0","i-zipqd(13160)  >  https(443) [ACK] Seq=637 Ack=1891 Win=255 Len=0"
"111","6.824354","0.004814","0.017827000","LAPTOP-KeiyuKensei.local","signaler-pa.GoOgLeapIS.coM","TLSv1.2","245","255","191","Application Data"
"112","6.825927","0.001573","0.006387000","LAPTOP-KeiyuKensei.local","signaler-pa.GoOgLeapIS.coM","TLSv1.2","595","255","541","Application Data"
"113","6.835722","0.009795","0.011368000","signaler-pa.GoOgLeapIS.coM","LAPTOP-KeiyuKensei.local","TCP","56","4879","0","https(443)  >  13135 [ACK] Seq=683 Ack=1797 Win=4879 Len=0"
"114","6.835833","0.000111","0.009906000","signaler-pa.GoOgLeapIS.coM","LAPTOP-KeiyuKensei.local","TCP","56","475","0","https(443)  >  i-zipqd(13160) [ACK] Seq=1891 Ack=1178 Win=475 Len=0"
"115","6.911981","0.076148","2.305876000","LAPTOP-KeiyuKensei.local","eu-autoupdate.opera.com","TLSv1.3","118","255","64","Change Cipher Spec, Application Data"
"116","6.913157","0.001176","2.153106000","LAPTOP-KeiyuKensei.local","eu-autoupdate.opera.com","TLSv1.3","118","255","64","Change Cipher Spec, Application Data"
"117","6.914078","0.000921","2.285695000","LAPTOP-KeiyuKensei.local","proxy.gxcorner.games","TLSv1.3","118","253","64","Change Cipher Spec, Application Data"
"118","6.916178","0.002100","0.812469000","LAPTOP-KeiyuKensei.local","am4-sitecheck.opera.com","TLSv1.3","134","65535","80","Change Cipher Spec, Application Data"
"119","6.917107","0.000929","2.297520000","LAPTOP-KeiyuKensei.local","ams-af.oPEra.coM","TLSv1.3","134","255","80","Change Cipher Spec, Application Data"
"120","6.918070","0.000963","0.006089000","LAPTOP-KeiyuKensei.local","eu-autoupdate.opera.com","TLSv1.3","400","255","346","Application Data"
"121","6.918748","0.000678","0.005591000","LAPTOP-KeiyuKensei.local","eu-autoupdate.opera.com","TLSv1.3","469","255","415","Application Data"
"122","6.918983","0.000235","0.000235000","LAPTOP-KeiyuKensei.local","eu-autoupdate.opera.com","TCP","1466","255","1412","13998  >  https(443) [ACK] Seq=2274 Ack=3756 Win=65280 Len=1412 [TCP PDU reassembled in 124]"
"123","6.918983","0.000000","0.000000000","LAPTOP-KeiyuKensei.local","eu-autoupdate.opera.com","TCP","1466","255","1412","13998  >  https(443) [ACK] Seq=3686 Ack=3756 Win=65280 Len=1412 [TCP PDU reassembled in 124]"
"124","6.918983","0.000000","0.000000000","LAPTOP-KeiyuKensei.local","eu-autoupdate.opera.com","TLSv1.3","484","255","430","Application Data"
"125","6.919181","0.000198","0.005103000","LAPTOP-KeiyuKensei.local","proxy.gxcorner.games","TLSv1.3","146","253","92","Application Data"
"126","6.919964","0.000783","0.003786000","LAPTOP-KeiyuKensei.local","am4-sitecheck.opera.com","TLSv1.3","146","65535","92","Application Data"
"127","6.920639","0.000675","0.003532000","LAPTOP-KeiyuKensei.local","ams-af.oPEra.coM","TLSv1.3","146","255","92","Application Data"
"128","6.921363","0.000724","0.002182000","LAPTOP-KeiyuKensei.local","proxy.gxcorner.games","TLSv1.3","367","253","313","Application Data"
"129","6.921970","0.000607","0.002006000","LAPTOP-KeiyuKensei.local","am4-sitecheck.opera.com","TLSv1.3","323","65535","269","Application Data"
"130","6.922161","0.000191","0.000191000","LAPTOP-KeiyuKensei.local","am4-sitecheck.opera.com","TLSv1.3","141","65535","87","Application Data"
"131","6.922321","0.000160","0.001682000","LAPTOP-KeiyuKensei.local","ams-af.oPEra.coM","TLSv1.3","341","255","287","Application Data"
"132","6.934086","0.011765","0.012723000","proxy.gxcorner.games","LAPTOP-KeiyuKensei.local","TLSv1.3","566","8","512","Application Data, Application Data"
"133","6.939726","0.005640","0.005640000","proxy.gxcorner.games","LAPTOP-KeiyuKensei.local","TLSv1.3","85","8","31","Application Data"
"134","6.939836","0.000110","0.000110000","LAPTOP-KeiyuKensei.local","proxy.gxcorner.games","TCP","54","251","0","13995  >  https(443) [ACK] Seq=2296 Ack=4018 Win=64256 Len=0"
"135","6.942310","0.002474","0.020149000","am4-sitecheck.opera.com","LAPTOP-KeiyuKensei.local","TLSv1.3","116","41075","62","Application Data"
"136","6.945140","0.002830","0.005304000","LAPTOP-KeiyuKensei.local","proxy.gxcorner.games","TLSv1.3","85","251","31","Application Data"
"137","6.946293","0.001153","0.003983000","am4-sitecheck.opera.com","LAPTOP-KeiyuKensei.local","TLSv1.3","85","41075","31","Application Data"
"138","6.946435","0.000142","0.000142000","LAPTOP-KeiyuKensei.local","am4-sitecheck.opera.com","TLSv1.3","85","65473","31","Application Data"
"139","6.949812","0.003377","0.003377000","am4-sitecheck.opera.com","LAPTOP-KeiyuKensei.local","TCP","56","41075","0","https(443)  >  13999 [ACK] Seq=3215 Ack=2354 Win=41075 Len=0"
"140","6.949812","0.000000","0.000000000","am4-sitecheck.opera.com","LAPTOP-KeiyuKensei.local","TLSv1.3","89","41075","35","Application Data"
"141","6.949812","0.000000","0.004672000","proxy.gxcorner.games","LAPTOP-KeiyuKensei.local","TLSv1.3","463","8","409","Application Data"
"142","6.949812","0.000000","0.000000000","proxy.gxcorner.games","LAPTOP-KeiyuKensei.local","TLSv1.3","87","8","33","Application Data"
"143","6.949812","0.000000","0.000000000","proxy.gxcorner.games","LAPTOP-KeiyuKensei.local","TLSv1.3","85","8","31","Application Data"
"144","6.950030","0.000218","0.000218000","LAPTOP-KeiyuKensei.local","am4-sitecheck.opera.com","TCP","54","65407","0","13999  >  https(443) [ACK] Seq=2385 Ack=3250 Win=65407 Len=0"
"145","6.950093","0.000063","0.000281000","LAPTOP-KeiyuKensei.local","proxy.gxcorner.games","TCP","54","255","0","13995  >  https(443) [ACK] Seq=2327 Ack=4491 Win=65280 Len=0"
"146","6.954054","0.003961","0.035071000","eu-autoupdate.opera.com","LAPTOP-KeiyuKensei.local","TLSv1.3","133","83","79","Application Data"
"147","6.954054","0.000000","0.000000000","eu-autoupdate.opera.com","LAPTOP-KeiyuKensei.local","TLSv1.3","133","83","79","Application Data"
"148","6.954174","0.000120","0.000120000","LAPTOP-KeiyuKensei.local","eu-autoupdate.opera.com","TCP","54","255","0","13998  >  https(443) [ACK] Seq=5528 Ack=3914 Win=65280 Len=0"
"149","6.955564","0.001390","0.033243000","ams-af.oPEra.coM","LAPTOP-KeiyuKensei.local","TLSv1.3","116","83","62","Application Data"
"150","6.956314","0.000750","0.000750000","LAPTOP-KeiyuKensei.local","ams-af.oPEra.coM","TLSv1.3","85","255","31","Application Data"
"151","6.956553","0.000239","0.038483000","eu-autoupdate.opera.com","LAPTOP-KeiyuKensei.local","TLSv1.3","133","83","79","Application Data"
"152","6.956553","0.000000","0.000000000","eu-autoupdate.opera.com","LAPTOP-KeiyuKensei.local","TLSv1.3","133","83","79","Application Data"
"153","6.956677","0.000124","0.000124000","LAPTOP-KeiyuKensei.local","eu-autoupdate.opera.com","TCP","54","255","0","13994  >  https(443) [ACK] Seq=2141 Ack=3914 Win=65280 Len=0"
"154","6.958079","0.001402","0.003905000","eu-autoupdate.opera.com","LAPTOP-KeiyuKensei.local","TCP","56","83","0","https(443)  >  13998 [ACK] Seq=3914 Ack=3686 Win=42496 Len=0"
"155","6.958079","0.000000","0.000000000","eu-autoupdate.opera.com","LAPTOP-KeiyuKensei.local","TCP","56","83","0","https(443)  >  13998 [ACK] Seq=3914 Ack=5528 Win=42496 Len=0"
"156","6.962630","0.004551","0.006316000","ams-af.oPEra.coM","LAPTOP-KeiyuKensei.local","TLSv1.3","85","83","31","Application Data"
"157","6.962784","0.000154","0.006107000","eu-autoupdate.opera.com","LAPTOP-KeiyuKensei.local","TLSv1.3","650","83","596","Application Data"
"158","6.965951","0.003167","0.003321000","ams-af.oPEra.coM","LAPTOP-KeiyuKensei.local","TLSv1.3","407","83","353","Application Data"
"159","6.966112","0.000161","0.000161000","LAPTOP-KeiyuKensei.local","ams-af.oPEra.coM","TCP","54","254","0","13996  >  https(443) [ACK] Seq=2291 Ack=3424 Win=65024 Len=0"
"160","6.976691","0.010579","2.306623000","LAPTOP-KeiyuKensei.local","am4.lb.opera.technology","TLSv1.3","134","255","80","Change Cipher Spec, Application Data"
"161","6.977387","0.000696","0.000696000","LAPTOP-KeiyuKensei.local","am4.lb.opera.technology","TLSv1.3","146","255","92","Application Data"
"162","6.977665","0.000278","0.000278000","LAPTOP-KeiyuKensei.local","am4.lb.opera.technology","TLSv1.3","358","255","304","Application Data"
"163","6.981159","0.003494","0.023080000","eu-autoupdate.opera.com","LAPTOP-KeiyuKensei.local","TLSv1.3","946","83","892","Application Data"
"164","7.001422","0.020263","0.023757000","am4.lb.opera.technology","LAPTOP-KeiyuKensei.local","TCP","56","83","0","https(443)  >  13997 [ACK] Seq=2987 Ack=2311 Win=42496 Len=0"
"165","7.001422","0.000000","0.000000000","am4.lb.opera.technology","LAPTOP-KeiyuKensei.local","TLSv1.3","125","83","71","Application Data"
"166","7.002878","0.001456","0.001456000","LAPTOP-KeiyuKensei.local","am4.lb.opera.technology","TLSv1.3","85","255","31","Application Data"
"167","7.004818","0.001940","0.001940000","am4.lb.opera.technology","LAPTOP-KeiyuKensei.local","TCP","1466","83","1412","https(443)  >  13997 [ACK] Seq=3058 Ack=2311 Win=42496 Len=1412 [TCP PDU reassembled in 168]"
"168","7.004818","0.000000","0.000000000","am4.lb.opera.technology","LAPTOP-KeiyuKensei.local","TLSv1.3","727","83","673","Application Data"
"169","7.004818","0.000000","0.000000000","am4.lb.opera.technology","LAPTOP-KeiyuKensei.local","TLSv1.3","85","83","31","Application Data"
"170","7.004984","0.000166","0.000166000","LAPTOP-KeiyuKensei.local","am4.lb.opera.technology","TCP","54","255","0","13997  >  https(443) [ACK] Seq=2342 Ack=5174 Win=65280 Len=0"
"171","7.005116","0.000132","0.055023000","proxy.gxcorner.games","LAPTOP-KeiyuKensei.local","TCP","56","8","0","https(443)  >  13995 [ACK] Seq=4491 Ack=2327 Win=65536 Len=0"
"172","7.006260","0.001144","0.043476000","LAPTOP-KeiyuKensei.local","eu-autoupdate.opera.com","TCP","54","253","0","13994  >  https(443) [ACK] Seq=2141 Ack=4510 Win=64768 Len=0"
"173","7.014074","0.007814","0.178352000","signaler-pa.GoOgLeapIS.coM","LAPTOP-KeiyuKensei.local","TLSv1.2","353","4879","299","Application Data"
"174","7.014232","0.000158","0.064202000","am4-sitecheck.opera.com","LAPTOP-KeiyuKensei.local","TCP","56","41075","0","https(443)  >  13999 [ACK] Seq=3250 Ack=2385 Win=41075 Len=0"
"175","7.021651","0.007419","0.040492000","LAPTOP-KeiyuKensei.local","eu-autoupdate.opera.com","TCP","54","251","0","13998  >  https(443) [ACK] Seq=5528 Ack=4806 Win=64256 Len=0"
"176","7.042735","0.021084","0.076623000","ams-af.oPEra.coM","LAPTOP-KeiyuKensei.local","TCP","56","83","0","https(443)  >  13996 [ACK] Seq=3424 Ack=2291 Win=42496 Len=0"
"177","7.056592","0.013857","0.042518000","LAPTOP-KeiyuKensei.local","signaler-pa.GoOgLeapIS.coM","TCP","54","254","0","13135  >  https(443) [ACK] Seq=1797 Ack=982 Win=254 Len=0"
"178","7.069966","0.013374","0.064982000","am4.lb.opera.technology","LAPTOP-KeiyuKensei.local","TCP","56","83","0","https(443)  >  13997 [ACK] Seq=5174 Ack=2342 Win=42496 Len=0"
"179","7.173084","0.103118","0.158852000","am4-sitecheck.opera.com","LAPTOP-KeiyuKensei.local","TCP","1354","41075","1300","https(443)  >  13999 [ACK] Seq=3250 Ack=2385 Win=41075 Len=1300 [TCP PDU reassembled in 192]"
"180","7.173084","0.000000","0.000000000","am4-sitecheck.opera.com","LAPTOP-KeiyuKensei.local","TCP","1354","41075","1300","https(443)  >  13999 [PSH, ACK] Seq=4550 Ack=2385 Win=41075 Len=1300 [TCP PDU reassembled in 192]"
"181","7.173084","0.000000","0.000000000","am4-sitecheck.opera.com","LAPTOP-KeiyuKensei.local","TCP","1354","41075","1300","https(443)  >  13999 [ACK] Seq=5850 Ack=2385 Win=41075 Len=1300 [TCP PDU reassembled in 192]"
"182","7.173084","0.000000","0.000000000","am4-sitecheck.opera.com","LAPTOP-KeiyuKensei.local","TCP","1354","41075","1300","https(443)  >  13999 [PSH, ACK] Seq=7150 Ack=2385 Win=41075 Len=1300 [TCP PDU reassembled in 192]"
"183","7.173084","0.000000","0.000000000","am4-sitecheck.opera.com","LAPTOP-KeiyuKensei.local","TCP","1354","41075","1300","https(443)  >  13999 [ACK] Seq=8450 Ack=2385 Win=41075 Len=1300 [TCP PDU reassembled in 192]"
"184","7.173084","0.000000","0.000000000","am4-sitecheck.opera.com","LAPTOP-KeiyuKensei.local","TCP","1354","41075","1300","https(443)  >  13999 [PSH, ACK] Seq=9750 Ack=2385 Win=41075 Len=1300 [TCP PDU reassembled in 192]"
"185","7.173084","0.000000","0.000000000","am4-sitecheck.opera.com","LAPTOP-KeiyuKensei.local","TCP","1354","41075","1300","https(443)  >  13999 [ACK] Seq=11050 Ack=2385 Win=41075 Len=1300 [TCP PDU reassembled in 192]"
"186","7.173084","0.000000","0.000000000","am4-sitecheck.opera.com","LAPTOP-KeiyuKensei.local","TCP","1354","41075","1300","https(443)  >  13999 [PSH, ACK] Seq=12350 Ack=2385 Win=41075 Len=1300 [TCP PDU reassembled in 192]"
"187","7.173084","0.000000","0.000000000","am4-sitecheck.opera.com","LAPTOP-KeiyuKensei.local","TCP","1354","41075","1300","https(443)  >  13999 [ACK] Seq=13650 Ack=2385 Win=41075 Len=1300 [TCP PDU reassembled in 192]"
"188","7.173084","0.000000","0.000000000","am4-sitecheck.opera.com","LAPTOP-KeiyuKensei.local","TCP","1354","41075","1300","https(443)  >  13999 [PSH, ACK] Seq=14950 Ack=2385 Win=41075 Len=1300 [TCP PDU reassembled in 192]"
"189","7.173282","0.000198","0.000198000","LAPTOP-KeiyuKensei.local","am4-sitecheck.opera.com","TCP","54","65535","0","13999  >  https(443) [ACK] Seq=2385 Ack=16250 Win=65535 Len=0"
"190","7.201519","0.028237","0.028237000","am4-sitecheck.opera.com","LAPTOP-KeiyuKensei.local","TCP","1354","41075","1300","https(443)  >  13999 [ACK] Seq=16250 Ack=2385 Win=41075 Len=1300 [TCP PDU reassembled in 192]"
"191","7.201519","0.000000","0.000000000","am4-sitecheck.opera.com","LAPTOP-KeiyuKensei.local","TCP","1354","41075","1300","https(443)  >  13999 [PSH, ACK] Seq=17550 Ack=2385 Win=41075 Len=1300 [TCP PDU reassembled in 192]"
"192","7.201519","0.000000","0.000000000","am4-sitecheck.opera.com","LAPTOP-KeiyuKensei.local","TLSv1.3","1354","41075","1300","Application Data"
"193","7.201519","0.000000","0.000000000","am4-sitecheck.opera.com","LAPTOP-KeiyuKensei.local","TCP","1354","41075","1300","https(443)  >  13999 [PSH, ACK] Seq=20150 Ack=2385 Win=41075 Len=1300 [TCP PDU reassembled in 200]"
"194","7.201519","0.000000","0.000000000","am4-sitecheck.opera.com","LAPTOP-KeiyuKensei.local","TCP","1354","41075","1300","https(443)  >  13999 [ACK] Seq=21450 Ack=2385 Win=41075 Len=1300 [TCP PDU reassembled in 200]"
"195","7.201519","0.000000","0.000000000","am4-sitecheck.opera.com","LAPTOP-KeiyuKensei.local","TCP","1354","41075","1300","https(443)  >  13999 [PSH, ACK] Seq=22750 Ack=2385 Win=41075 Len=1300 [TCP PDU reassembled in 200]"
"196","7.201519","0.000000","0.000000000","am4-sitecheck.opera.com","LAPTOP-KeiyuKensei.local","TCP","1354","41075","1300","https(443)  >  13999 [ACK] Seq=24050 Ack=2385 Win=41075 Len=1300 [TCP PDU reassembled in 200]"
"197","7.201519","0.000000","0.000000000","am4-sitecheck.opera.com","LAPTOP-KeiyuKensei.local","TCP","1354","41075","1300","https(443)  >  13999 [PSH, ACK] Seq=25350 Ack=2385 Win=41075 Len=1300 [TCP PDU reassembled in 200]"
"198","7.201705","0.000186","0.000186000","LAPTOP-KeiyuKensei.local","am4-sitecheck.opera.com","TCP","54","65535","0","13999  >  https(443) [ACK] Seq=2385 Ack=26650 Win=65535 Len=0"
"199","7.201878","0.000173","0.000173000","am4-sitecheck.opera.com","LAPTOP-KeiyuKensei.local","TCP","1354","41075","1300","https(443)  >  13999 [ACK] Seq=26650 Ack=2385 Win=41075 Len=1300 [TCP PDU reassembled in 200]"
"200","7.201878","0.000000","0.000000000","am4-sitecheck.opera.com","LAPTOP-KeiyuKensei.local","TLSv1.3","1354","41075","1300","Application Data"
"201","7.201961","0.000083","0.000083000","LAPTOP-KeiyuKensei.local","am4-sitecheck.opera.com","TCP","54","65535","0","13999  >  https(443) [ACK] Seq=2385 Ack=29250 Win=65535 Len=0"
"202","7.202042","0.000081","0.000081000","am4-sitecheck.opera.com","LAPTOP-KeiyuKensei.local","TCP","1354","41075","1300","https(443)  >  13999 [ACK] Seq=29250 Ack=2385 Win=41075 Len=1300 [TCP PDU reassembled in 216]"
"203","7.202042","0.000000","0.000000000","am4-sitecheck.opera.com","LAPTOP-KeiyuKensei.local","TCP","1354","41075","1300","https(443)  >  13999 [PSH, ACK] Seq=30550 Ack=2385 Win=41075 Len=1300 [TCP PDU reassembled in 216]"
"204","7.202122","0.000080","0.000080000","LAPTOP-KeiyuKensei.local","am4-sitecheck.opera.com","TCP","54","65535","0","13999  >  https(443) [ACK] Seq=2385 Ack=31850 Win=65535 Len=0"
"205","7.202241","0.000119","0.000119000","am4-sitecheck.opera.com","LAPTOP-KeiyuKensei.local","TCP","1354","41075","1300","https(443)  >  13999 [ACK] Seq=31850 Ack=2385 Win=41075 Len=1300 [TCP PDU reassembled in 216]"
"206","7.202241","0.000000","0.000000000","am4-sitecheck.opera.com","LAPTOP-KeiyuKensei.local","TCP","1354","41075","1300","https(443)  >  13999 [PSH, ACK] Seq=33150 Ack=2385 Win=41075 Len=1300 [TCP PDU reassembled in 216]"
"207","7.202241","0.000000","0.000000000","am4-sitecheck.opera.com","LAPTOP-KeiyuKensei.local","TCP","1354","41075","1300","https(443)  >  13999 [ACK] Seq=34450 Ack=2385 Win=41075 Len=1300 [TCP PDU reassembled in 216]"
"208","7.202241","0.000000","0.000000000","am4-sitecheck.opera.com","LAPTOP-KeiyuKensei.local","TCP","1354","41075","1300","https(443)  >  13999 [PSH, ACK] Seq=35750 Ack=2385 Win=41075 Len=1300 [TCP PDU reassembled in 216]"
"209","7.202241","0.000000","0.000000000","am4-sitecheck.opera.com","LAPTOP-KeiyuKensei.local","TCP","1354","41075","1300","https(443)  >  13999 [ACK] Seq=37050 Ack=2385 Win=41075 Len=1300 [TCP PDU reassembled in 216]"
"210","7.202241","0.000000","0.000000000","am4-sitecheck.opera.com","LAPTOP-KeiyuKensei.local","TCP","1354","41075","1300","https(443)  >  13999 [PSH, ACK] Seq=38350 Ack=2385 Win=41075 Len=1300 [TCP PDU reassembled in 216]"
"211","7.202241","0.000000","0.000000000","am4-sitecheck.opera.com","LAPTOP-KeiyuKensei.local","TCP","1354","41075","1300","https(443)  >  13999 [ACK] Seq=39650 Ack=2385 Win=41075 Len=1300 [TCP PDU reassembled in 216]"
"212","7.202241","0.000000","0.000000000","am4-sitecheck.opera.com","LAPTOP-KeiyuKensei.local","TCP","1354","41075","1300","https(443)  >  13999 [PSH, ACK] Seq=40950 Ack=2385 Win=41075 Len=1300 [TCP PDU reassembled in 216]"
"213","7.202358","0.000117","0.000117000","LAPTOP-KeiyuKensei.local","am4-sitecheck.opera.com","TCP","54","65535","0","13999  >  https(443) [ACK] Seq=2385 Ack=42250 Win=65535 Len=0"
"214","7.217706","0.015348","","myfastgate","Broadcast","ARP","42","","","Who has 192.168.1.136? Tell 192.168.1.254"
"215","7.229740","0.012034","0.027382000","am4-sitecheck.opera.com","LAPTOP-KeiyuKensei.local","TCP","1354","41075","1300","https(443)  >  13999 [ACK] Seq=42250 Ack=2385 Win=41075 Len=1300 [TCP PDU reassembled in 216]"
"216","7.229740","0.000000","0.000000000","am4-sitecheck.opera.com","LAPTOP-KeiyuKensei.local","TLSv1.3","1354","41075","1300","Application Data"
"217","7.229740","0.000000","0.000000000","am4-sitecheck.opera.com","LAPTOP-KeiyuKensei.local","TCP","1354","41075","1300","https(443)  >  13999 [ACK] Seq=44850 Ack=2385 Win=41075 Len=1300 [TCP PDU reassembled in 231]"
"218","7.229874","0.000134","0.000134000","LAPTOP-KeiyuKensei.local","am4-sitecheck.opera.com","TCP","54","65535","0","13999  >  https(443) [ACK] Seq=2385 Ack=46150 Win=65535 Len=0"
"219","7.229973","0.000099","0.000099000","am4-sitecheck.opera.com","LAPTOP-KeiyuKensei.local","TCP","1354","41075","1300","https(443)  >  13999 [PSH, ACK] Seq=46150 Ack=2385 Win=41075 Len=1300 [TCP PDU reassembled in 231]"
"220","7.230160","0.000187","0.000187000","LAPTOP-KeiyuKensei.local","am4-sitecheck.opera.com","TCP","54","64235","0","13999  >  https(443) [ACK] Seq=2385 Ack=47450 Win=64235 Len=0"
"221","7.230319","0.000159","0.000159000","am4-sitecheck.opera.com","LAPTOP-KeiyuKensei.local","TCP","1354","41075","1300","https(443)  >  13999 [ACK] Seq=47450 Ack=2385 Win=41075 Len=1300 [TCP PDU reassembled in 231]"
"222","7.230319","0.000000","0.000000000","am4-sitecheck.opera.com","LAPTOP-KeiyuKensei.local","TCP","1354","41075","1300","https(443)  >  13999 [ACK] Seq=48750 Ack=2385 Win=41075 Len=1300 [TCP PDU reassembled in 231]"
"223","7.230319","0.000000","0.000000000","am4-sitecheck.opera.com","LAPTOP-KeiyuKensei.local","TCP","1354","41075","1300","https(443)  >  13999 [PSH, ACK] Seq=50050 Ack=2385 Win=41075 Len=1300 [TCP PDU reassembled in 231]"
"224","7.230397","0.000078","0.000078000","LAPTOP-KeiyuKensei.local","am4-sitecheck.opera.com","TCP","54","65535","0","13999  >  https(443) [ACK] Seq=2385 Ack=51350 Win=65535 Len=0"
"225","7.230499","0.000102","0.000102000","am4-sitecheck.opera.com","LAPTOP-KeiyuKensei.local","TCP","1354","41075","1300","https(443)  >  13999 [ACK] Seq=51350 Ack=2385 Win=41075 Len=1300 [TCP PDU reassembled in 231]"
"226","7.230548","0.000049","0.000049000","LAPTOP-KeiyuKensei.local","am4-sitecheck.opera.com","TCP","54","64235","0","13999  >  https(443) [ACK] Seq=2385 Ack=52650 Win=64235 Len=0"
